<?xml version="1.0" encoding="UTF-8" standalone="no"?>
<register_list name="CP15"
    xmlns:xsi="http://www.w3.org/2001/XMLSchema-instance"
    xmlns="http://www.arm.com/core_reg"
    xsi:schemaLocation="http://www.arm.com/core_reg ../../../Schemas/core_register_definition.xsd"
    xmlns:xi="http://www.w3.org/2001/XInclude"
    xmlns:tcf="http://com.arm.targetconfigurationeditor">
    <register_group name="FaultHandling">
        <gui_name language="en">Fault Handling</gui_name>
        <description language="en">PL1 Fault-Handling Registers</description>
        <register access="RW" name="DFSR" size="4">
            <gui_name language="en">DFSR</gui_name>
            <alias_name>CP15_DFSR</alias_name>
            <device_name type="rvi">CP15_DFSR</device_name>
            <device_name type="cadi">DFSR</device_name>
            <device_name type="rvi">CP15_DFSR</device_name>
            <device_name type="cadi">DFSR</device_name>
            <description language="en">Data Fault Status</description>
            <bitField conditional="false" name="CM" enumerationId="DFSR_CM">
                <gui_name language="en">CM</gui_name>
                <description language="en">Cache Maintenance</description>
                <definition>[13]</definition>
            </bitField>
            <bitField conditional="false" name="EXT">
                <gui_name language="en">EXT</gui_name>
                <description language="en">External abort type</description>
                <definition>[12]</definition>
            </bitField>
            <bitField conditional="false" name="WNR" enumerationId="DFSR_WNR">
                <gui_name language="en">WnR</gui_name>
                <description language="en">Access type causing abort</description>
                <definition>[11]</definition>
            </bitField>
            <bitField conditional="false" name="FS">
                <gui_name language="en">FS</gui_name>
                <description language="en">Fault Status</description>
                <definition>[3:0][10]</definition>
            </bitField>
        </register>
        <register access="RW" name="IFSR" size="4">
            <gui_name language="en">IFSR</gui_name>
            <alias_name>CP15_IFSR</alias_name>
            <device_name type="rvi">CP15_IFSR</device_name>
            <device_name type="cadi">IFSR</device_name>
            <device_name type="rvi">CP15_IFSR</device_name>
            <device_name type="cadi">IFSR</device_name>
            <description language="en">Instruction Fault Status</description>
            <bitField conditional="false" name="EXT">
                <gui_name language="en">EXT</gui_name>
                <description language="en">External abort type</description>
                <definition>[12]</definition>
            </bitField>
            <bitField conditional="false" enumerationId="FAULTS_IFSR_FS" name="FS">
                <gui_name language="en">FS</gui_name>
                <description language="en">Fault Status</description>
                <definition>[3:0][10]</definition>
            </bitField>
        </register>
        <register access="RW" name="AIFSR" size="4">
            <gui_name language="en">AIFSR</gui_name>
            <alias_name>CP15_AIFSR</alias_name>
            <device_name type="rvi">CP15_AIFSR</device_name>
            <device_name type="cadi">AIFSR</device_name>
            <device_name type="rvi">CP15_AIFSR</device_name>
            <device_name type="cadi">AIFSR</device_name>
            <description language="en">Auxiliary Instruction Fault Status</description>
            <!-- Cortex-A7, A12 and A15 do not implement ADFSR, so this register is always UNK/SBZP. -->
        </register>
        <register access="RW" name="DFAR" size="4">
            <gui_name language="en">DFAR</gui_name>
            <alias_name>CP15_DFAR</alias_name>
            <device_name type="rvi">CP15_DFAR</device_name>
            <device_name type="cadi">DFAR</device_name>
            <device_name type="rvi">CP15_DFAR</device_name>
            <device_name type="cadi">DFAR</device_name>
            <description language="en">Data Fault Address</description>
        </register>
        <register access="RW" name="IFAR" size="4">
            <gui_name language="en">IFAR</gui_name>
            <alias_name>CP15_IFAR</alias_name>
            <device_name type="rvi">CP15_IFAR</device_name>
            <device_name type="cadi">IFAR</device_name>
            <device_name type="rvi">CP15_IFAR</device_name>
            <device_name type="cadi">IFAR</device_name>
            <description language="en">Instruction Fault Address</description>
        </register>
    </register_group>
</register_list>

