<?xml version="1.0" encoding="UTF-8"?>
<register_list name="System" xmlns="http://www.arm.com/core_reg" xmlns:tcf="http://com.arm.targetconfigurationeditor" xmlns:xi="http://www.w3.org/2001/XInclude" xmlns:xsi="http://www.w3.org/2001/XMLSchema-instance" xsi:schemaLocation="http://www.arm.com/core_reg ../../../Schemas/core_register_definition.xsd">
  <!--PLEASE DO NOT EDIT THIS FILE - Generated from SysReg_v81A_xml-00bet3-->
  <register_group name="Thread">
    <gui_name language="en">Thread</gui_name>
    <description language="en">Thread</description>
    <register access="RW" doclink="CDB://../../../Docs/SysReg_v81A_xml-00bet3/xhtml/AArch32-htpidr.html" name="HTPIDR" size="4">
      <gui_name language="en">Hyp Software Thread ID Register</gui_name>
      <description language="en">Provides a location where software running in Hyp mode can store thread identifying information that is not visible to Non-secure software executing at EL0 or EL1, for hypervisor management purposes...</description>
    </register>
    <register access="RW" doclink="CDB://../../../Docs/SysReg_v81A_xml-00bet3/xhtml/AArch32-tpidrprw.html" name="TPIDRPRW" size="4">
      <gui_name language="en">PL1 Software Thread ID Register</gui_name>
      <description language="en">Provides a location where software executing at EL1 or higher can store thread identifying information that is not visible to software executing at EL0, for OS management purposes...</description>
    </register>
    <register access="RW" doclink="CDB://../../../Docs/SysReg_v81A_xml-00bet3/xhtml/AArch32-tpidrprw.html" name="S_TPIDRPRW" size="4">
      <gui_name language="en">PL1 Software Thread ID Register</gui_name>
      <description language="en">Provides a location where software executing at EL1 or higher can store thread identifying information that is not visible to software executing at EL0, for OS management purposes...</description>
    </register>
    <register access="RW" doclink="CDB://../../../Docs/SysReg_v81A_xml-00bet3/xhtml/AArch32-tpidrprw.html" name="N_TPIDRPRW" size="4">
      <gui_name language="en">PL1 Software Thread ID Register</gui_name>
      <description language="en">Provides a location where software executing at EL1 or higher can store thread identifying information that is not visible to software executing at EL0, for OS management purposes...</description>
    </register>
    <register access="RW" doclink="CDB://../../../Docs/SysReg_v81A_xml-00bet3/xhtml/AArch32-tpidruro.html" name="TPIDRURO" size="4">
      <gui_name language="en">PL0 Read-Only Software Thread ID Register</gui_name>
      <description language="en">Provides a location where software executing at EL1 or higher can store thread identifying information that is visible to software executing at EL0, for OS management purposes...</description>
    </register>
    <register access="RW" doclink="CDB://../../../Docs/SysReg_v81A_xml-00bet3/xhtml/AArch32-tpidruro.html" name="S_TPIDRURO" size="4">
      <gui_name language="en">PL0 Read-Only Software Thread ID Register</gui_name>
      <description language="en">Provides a location where software executing at EL1 or higher can store thread identifying information that is visible to software executing at EL0, for OS management purposes...</description>
    </register>
    <register access="RW" doclink="CDB://../../../Docs/SysReg_v81A_xml-00bet3/xhtml/AArch32-tpidruro.html" name="N_TPIDRURO" size="4">
      <gui_name language="en">PL0 Read-Only Software Thread ID Register</gui_name>
      <description language="en">Provides a location where software executing at EL1 or higher can store thread identifying information that is visible to software executing at EL0, for OS management purposes...</description>
    </register>
    <register access="RW" doclink="CDB://../../../Docs/SysReg_v81A_xml-00bet3/xhtml/AArch32-tpidrurw.html" name="TPIDRURW" size="4">
      <gui_name language="en">PL0 Read/Write Software Thread ID Register</gui_name>
      <description language="en">Provides a location where software executing at EL0 can store thread identifying information, for OS management purposes...</description>
    </register>
    <register access="RW" doclink="CDB://../../../Docs/SysReg_v81A_xml-00bet3/xhtml/AArch32-tpidrurw.html" name="S_TPIDRURW" size="4">
      <gui_name language="en">PL0 Read/Write Software Thread ID Register</gui_name>
      <description language="en">Provides a location where software executing at EL0 can store thread identifying information, for OS management purposes...</description>
    </register>
    <register access="RW" doclink="CDB://../../../Docs/SysReg_v81A_xml-00bet3/xhtml/AArch32-tpidrurw.html" name="N_TPIDRURW" size="4">
      <gui_name language="en">PL0 Read/Write Software Thread ID Register</gui_name>
      <description language="en">Provides a location where software executing at EL0 can store thread identifying information, for OS management purposes...</description>
    </register>
  </register_group>
</register_list>
