<?xml version="1.0" encoding="UTF-8"?>
<register_list name="System" xmlns="http://www.arm.com/core_reg" xmlns:tcf="http://com.arm.targetconfigurationeditor" xmlns:xi="http://www.w3.org/2001/XInclude" xmlns:xsi="http://www.w3.org/2001/XMLSchema-instance" xsi:schemaLocation="http://www.arm.com/core_reg ../../../Schemas/core_register_definition.xsd">
  <!--PLEASE DO NOT EDIT THIS FILE - Generated from SysReg_xml-00bet19-->
  <register_group name="Legacy">
    <gui_name language="en">Legacy</gui_name>
    <description language="en">Legacy</description>
    <register access="WO" doclink="CDB://../../../Docs/SysReg_xml-00bet19/xhtml/AArch32-cp15dmb.html" name="CP15DMB" size="4">
      <gui_name language="en">Data Memory Barrier System instruction</gui_name>
      <description language="en">Performs a Data Memory Barrier...</description>
    </register>
    <register access="WO" doclink="CDB://../../../Docs/SysReg_xml-00bet19/xhtml/AArch32-cp15dsb.html" name="CP15DSB" size="4">
      <gui_name language="en">Data Synchronization Barrier System instruction</gui_name>
      <description language="en">Performs a Data Synchronization Barrier...</description>
    </register>
    <register access="WO" doclink="CDB://../../../Docs/SysReg_xml-00bet19/xhtml/AArch32-cp15isb.html" name="CP15ISB" size="4">
      <gui_name language="en">Instruction Synchronization Barrier System instruction</gui_name>
      <description language="en">Performs an Instruction Synchronization Barrier...</description>
    </register>
    <register access="RW" doclink="CDB://../../../Docs/SysReg_xml-00bet19/xhtml/AArch32-fcseidr.html" name="FCSEIDR" size="4">
      <gui_name language="en">FCSE Process ID register</gui_name>
      <description language="en">Identifies whether the Fast Context Switch Extension (FCSE) is implemented...</description>
    </register>
    <register access="RW" doclink="CDB://../../../Docs/SysReg_xml-00bet19/xhtml/AArch32-jidr.html" name="JIDR" size="4">
      <gui_name language="en">Jazelle ID Register</gui_name>
      <description language="en">A Jazelle register, which identified the Jazelle architecture version.</description>
    </register>
    <register access="RW" doclink="CDB://../../../Docs/SysReg_xml-00bet19/xhtml/AArch32-jmcr.html" name="JMCR" size="4">
      <gui_name language="en">Jazelle Main Configuration Register</gui_name>
      <description language="en">A Jazelle register, which provides control of the Jazelle extension.</description>
    </register>
    <register access="RW" doclink="CDB://../../../Docs/SysReg_xml-00bet19/xhtml/AArch32-joscr.html" name="JOSCR" size="4">
      <gui_name language="en">Jazelle OS Control Register</gui_name>
      <description language="en">A Jazelle register, which provides operating system control of the Jazelle Extension.</description>
    </register>
  </register_group>
</register_list>
