<?xml version="1.0" encoding="UTF-8" standalone="no"?>
<register_list
    name="CP15"
    xmlns:xsi="http://www.w3.org/2001/XMLSchema-instance"
    xmlns="http://www.arm.com/core_reg"
    xsi:schemaLocation="http://www.arm.com/core_reg ../../../Schemas/core_register_definition.xsd"
    xmlns:tcf="http://com.arm.targetconfigurationeditor">
    <register_group name="TCM">
        <gui_name language="en">TCM</gui_name>
        <description language="en">Tightly Coupled Memory control</description>
        <register access="RO" name="TCM_STATUS" size="4">
            <gui_name language="en">TCM Status</gui_name>
            <alias_name>CP15_TCM_STATUS</alias_name>
            <device_name type="rvi">CP15_TCM_STATUS</device_name>
            <device_name type="cadi">CP15_TCM_STATUS</device_name>
            <description language="en">Specifies the number of instruction and data TCMs in the system</description>
            <bitField conditional="false" name="DTCM">
                <gui_name language="en">DTCM</gui_name>
                <description language="en">Specifies the number of data TCM banks implemented</description>
                <definition>[18:16]</definition>
            </bitField>
            <bitField conditional="false" name="ITCM">
                <gui_name language="en">ITCM</gui_name>
                <description language="en">Specifies the number of instruction TCM banks implemented</description>
                <definition>[2:0]</definition>
            </bitField>
        </register>
        <register access="RW" name="DTCM_REGION" size="4">
            <gui_name language="en">Data TCM Region</gui_name>
            <alias_name>CP15_DTCM_REGION</alias_name>
            <device_name type="rvi">CP15_DTCM_REGION</device_name>
            <device_name type="cadi">CP15_DTCM_REGION</device_name>
            <description language="en">Holds the base address, size and enable bit of the data TCM</description>
            <bitField conditional="false" name="Base_address">
                <gui_name language="en">Base address</gui_name>
                <description language="en">Defines the physical base address of the data TCM</description>
                <definition>[31:12]</definition>
            </bitField>
            <bitField conditional="false" name="Size" enumerationId="CP15_XTCM_REGION_SIZE">
                <gui_name language="en">Size</gui_name>
                <description language="en">Defines the size of the data TCM on reads</description>
                <definition>[6:2]</definition>
            </bitField>
            <bitField conditional="false" name="Enable">
                <gui_name language="en">Enable</gui_name>
                <description language="en">Enables or disables the data TCM</description>
                <definition>[0]</definition>
            </bitField>
        </register>
        <register access="RW" name="ITCM_REGION" size="4">
            <gui_name language="en">Instruction TCM Region</gui_name>
            <alias_name>CP15_ITCM_REGION</alias_name>
            <device_name type="rvi">CP15_ITCM_REGION</device_name>
            <device_name type="cadi">CP15_ITCM_REGION</device_name>
            <description language="en">Holds the base address, size and enable bit of the instruction TCM</description>
            <bitField conditional="false" name="Base_address">
                <gui_name language="en">Base address</gui_name>
                <description language="en">Defines the physical base address of the instruction TCM</description>
                <definition>[31:12]</definition>
            </bitField>
            <bitField conditional="false" name="Size" enumerationId="CP15_XTCM_REGION_SIZE">
                <gui_name language="en">Size</gui_name>
                <description language="en">Defines the size of the instruction TCM on reads</description>
                <definition>[6:2]</definition>
            </bitField>
            <bitField conditional="false" name="Enable">
                <gui_name language="en">Enable</gui_name>
                <description language="en">Enables or disables the instruction TCM</description>
                <definition>[0]</definition>
            </bitField>
        </register>
    </register_group>
</register_list>

