<?xml version="1.0" encoding="UTF-8" standalone="no"?>
<register_list xmlns="http://www.arm.com/core_reg" xmlns:tcf="http://com.arm.targetconfigurationeditor" xmlns:xi="http://www.w3.org/2001/XInclude" xmlns:xsi="http://www.w3.org/2001/XMLSchema-instance" name="System" xsi:schemaLocation="http://www.arm.com/core_reg ../../../Schemas/core_register_definition.xsd">
    <register_group name="ImplementationDefined">
        <gui_name language="en">Implementation Defined</gui_name>
        <description language="en">Implementation Defined</description>
        <register access="RW" name="L2CTLR" size="4">
            <gui_name language="en">L2 Control Register</gui_name>
            <description language="en">L2 Control Register.</description>
        </register>
        <register access="RW" name="L2ECTLR" size="4">
            <gui_name language="en">L2 Extended Control Register</gui_name>
            <description language="en">L2 Extended Control Register.</description>
        </register>
        <register access="RO" name="CBAR" size="4">
            <gui_name language="en">Configuration Base Address Register</gui_name>
            <description language="en">Configuration Base Address Register.</description>
        </register>
        <register access="RW" name="ECTLR" size="4">
            <gui_name language="en">Extended Control Register</gui_name>
            <description language="en">Extended Control Register.</description>
        </register>
        <register access="RW" name="L2MERRSR" size="8">
            <gui_name language="en">L2 Memory Error Syndrome Register</gui_name>
            <description language="en">L2 Memory Error Syndrome Register.</description>
        </register>
    </register_group>
</register_list>
