<?xml version="1.0" encoding="UTF-8"?>
<register_list name="System" xmlns="http://www.arm.com/core_reg" xmlns:tcf="http://com.arm.targetconfigurationeditor" xmlns:xi="http://www.w3.org/2001/XInclude" xmlns:xsi="http://www.w3.org/2001/XMLSchema-instance" xsi:schemaLocation="http://www.arm.com/core_reg ../../../Schemas/core_register_definition.xsd">
  <!--PLEASE DO NOT EDIT THIS FILE - Generated from SysReg_v81A_xml-00bet3-->
  <register_group name="Address">
    <gui_name language="en">Address</gui_name>
    <description language="en">Address</description>
    <register access="RW" doclink="CDB://../../../Docs/SysReg_v81A_xml-00bet3/xhtml/AArch64-par_el1.html" name="PAR_EL1" size="8">
      <gui_name language="en">Physical Address Register</gui_name>
      <description language="en">Returns the output address (OA) from an Address translation instruction that executed successfully, or fault information if the instruction did not execute successfully.</description>
      <bitField enumerationId="PAR_EL1_F" name="F">
        <gui_name language="en">F</gui_name>
        <description language="en">Indicates whether the instruction performed a successful address translation.</description>
        <definition>[0]</definition>
      </bitField>
    </register>
    <register access="WO" doclink="CDB://../../../Docs/SysReg_v81A_xml-00bet3/xhtml/AArch64-at-s12e0r.html" name="AT_S12E0R" size="8">
      <gui_name language="en">Address Translate Stages 1 and 2 EL0 Read</gui_name>
      <device_name type="rvi">AT_S12E0R</device_name>
      <device_name type="cadi">AT S12E0R</device_name>
      <description language="en">Performs stage 1 and 2 address translations, with permissions as if reading from the given virtual address, using the following translation regime...</description>
    </register>
    <register access="WO" doclink="CDB://../../../Docs/SysReg_v81A_xml-00bet3/xhtml/AArch64-at-s12e0w.html" name="AT_S12E0W" size="8">
      <gui_name language="en">Address Translate Stages 1 and 2 EL0 Write</gui_name>
      <device_name type="rvi">AT_S12E0W</device_name>
      <device_name type="cadi">AT S12E0W</device_name>
      <description language="en">Performs stage 1 and 2 address translations, with permissions as if writing to the given virtual address, using the following translation regime...</description>
    </register>
    <register access="WO" doclink="CDB://../../../Docs/SysReg_v81A_xml-00bet3/xhtml/AArch64-at-s12e1r.html" name="AT_S12E1R" size="8">
      <gui_name language="en">Address Translate Stages 1 and 2 EL1 Read</gui_name>
      <device_name type="rvi">AT_S12E1R</device_name>
      <device_name type="cadi">AT S12E1R</device_name>
      <description language="en">Performs stage 1 and 2 address translation, with permissions as if reading from the given virtual address, using the following translation regime...</description>
    </register>
    <register access="WO" doclink="CDB://../../../Docs/SysReg_v81A_xml-00bet3/xhtml/AArch64-at-s12e1w.html" name="AT_S12E1W" size="8">
      <gui_name language="en">Address Translate Stages 1 and 2 EL1 Write</gui_name>
      <device_name type="rvi">AT_S12E1W</device_name>
      <device_name type="cadi">AT S12E1W</device_name>
      <description language="en">Performs stage 1 and 2 address translation, with permissions as if writing to the given virtual address, using the following translation regime...</description>
    </register>
    <register access="WO" doclink="CDB://../../../Docs/SysReg_v81A_xml-00bet3/xhtml/AArch64-at-s1e0r.html" name="AT_S1E0R" size="8">
      <gui_name language="en">Address Translate Stage 1 EL0 Read</gui_name>
      <device_name type="rvi">AT_S1E0R</device_name>
      <device_name type="cadi">AT S1E0R</device_name>
      <description language="en">Performs stage 1 address translation, with permissions as if reading from the given virtual address, using the following translation regime...</description>
    </register>
    <register access="WO" doclink="CDB://../../../Docs/SysReg_v81A_xml-00bet3/xhtml/AArch64-at-s1e0w.html" name="AT_S1E0W" size="8">
      <gui_name language="en">Address Translate Stage 1 EL0 Write</gui_name>
      <device_name type="rvi">AT_S1E0W</device_name>
      <device_name type="cadi">AT S1E0W</device_name>
      <description language="en">Performs stage 1 address translation, with permissions as if writing to the given virtual address, using the following translation regime...</description>
    </register>
    <register access="WO" doclink="CDB://../../../Docs/SysReg_v81A_xml-00bet3/xhtml/AArch64-at-s1e1r.html" name="AT_S1E1R" size="8">
      <gui_name language="en">Address Translate Stage 1 EL1 Read</gui_name>
      <device_name type="rvi">AT_S1E1R</device_name>
      <device_name type="cadi">AT S1E1R</device_name>
      <description language="en">Performs stage 1 address translation, with permissions as if reading from the given virtual address, using the following translation regime...</description>
    </register>
    <register access="WO" doclink="CDB://../../../Docs/SysReg_v81A_xml-00bet3/xhtml/AArch64-at-s1e1w.html" name="AT_S1E1W" size="8">
      <gui_name language="en">Address Translate Stage 1 EL1 Write</gui_name>
      <device_name type="rvi">AT_S1E1W</device_name>
      <device_name type="cadi">AT S1E1W</device_name>
      <description language="en">Performs stage 1 address translation, with permissions as if writing to the given virtual address, using the following translation regime...</description>
    </register>
    <register access="WO" doclink="CDB://../../../Docs/SysReg_v81A_xml-00bet3/xhtml/AArch64-at-s1e2r.html" name="AT_S1E2R" size="8">
      <gui_name language="en">Address Translate Stage 1 EL2 Read</gui_name>
      <device_name type="rvi">AT_S1E2R</device_name>
      <device_name type="cadi">AT S1E2R</device_name>
      <description language="en">Performs stage 1 address translation as defined for EL2, with permissions as if reading from the given virtual address.</description>
    </register>
    <register access="WO" doclink="CDB://../../../Docs/SysReg_v81A_xml-00bet3/xhtml/AArch64-at-s1e2w.html" name="AT_S1E2W" size="8">
      <gui_name language="en">Address Translate Stage 1 EL2 Write</gui_name>
      <device_name type="rvi">AT_S1E2W</device_name>
      <device_name type="cadi">AT S1E2W</device_name>
      <description language="en">Performs stage 1 address translation as defined for EL2, with permissions as if writing to the given virtual address.</description>
    </register>
    <register access="WO" doclink="CDB://../../../Docs/SysReg_v81A_xml-00bet3/xhtml/AArch64-at-s1e3r.html" name="AT_S1E3R" size="8">
      <gui_name language="en">Address Translate Stage 1 EL3 Read</gui_name>
      <device_name type="rvi">AT_S1E3R</device_name>
      <device_name type="cadi">AT S1E3R</device_name>
      <description language="en">Performs stage 1 address translation as defined for EL3, with permissions as if reading from the given virtual address.</description>
    </register>
    <register access="WO" doclink="CDB://../../../Docs/SysReg_v81A_xml-00bet3/xhtml/AArch64-at-s1e3w.html" name="AT_S1E3W" size="8">
      <gui_name language="en">Address Translate Stage 1 EL3 Write</gui_name>
      <device_name type="rvi">AT_S1E3W</device_name>
      <device_name type="cadi">AT S1E3W</device_name>
      <description language="en">Performs stage 1 address translation as defined for EL3, with permissions as if writing to the given virtual address.</description>
    </register>
  </register_group>
  <tcf:enumeration name="PAR_EL1_F">
    <tcf:enumItem description="Address translation completed successfully." name="Address_translation_completed_successfully" number="0"/>
    <tcf:enumItem description="Address translation aborted." name="Address_translation_aborted" number="1"/>
  </tcf:enumeration>
</register_list>
