<?xml version="1.0" encoding="UTF-8" standalone="no"?>
<register_list name="CP15"
               xmlns:xsi="http://www.w3.org/2001/XMLSchema-instance"
               xmlns="http://www.arm.com/core_reg"
               xsi:schemaLocation="http://www.arm.com/core_reg ../../../Schemas/core_register_definition.xsd"
               xmlns:tcf="http://com.arm.targetconfigurationeditor">

<register_group name="TLB">
        <gui_name language="en">TLB</gui_name>
        <description language="en">TLB Operations</description>
    <register access="WO" name="TLBIALLIS" size="4">
        <gui_name language="en">TLBIALLIS</gui_name>
        <alias_name>CP15_TLBIALLIS</alias_name>
        <device_name type="rvi">CP15_TLBIALLIS</device_name>
        <device_name type="cadi">TLBIALLIS</device_name>
        <description language="en">Invalidate entire Unified TLB Inner Shareable</description>
    </register>
    <register access="WO" name="TLBIMVAIS" size="4">
        <gui_name language="en">TLBIMVAIS</gui_name>
        <alias_name>CP15_TLBIMVAIS</alias_name>
        <device_name type="rvi">CP15_TLBIMVAIS</device_name>
        <device_name type="cadi">TLBIMVAIS</device_name>
        <description language="en">Invalidate Unified TLB entry by MVA Inner Shareable</description>
    </register>
    <register access="WO" name="TLBIASIDIS" size="4">
        <gui_name language="en">TLBIASIDIS</gui_name>
        <alias_name>CP15_TLBIASIDIS</alias_name>
        <device_name type="rvi">CP15_TLBIASIDIS</device_name>
        <device_name type="cadi">TLBIASIDIS</device_name>
        <description language="en">Invalidate Unified TLB entry by ASID match Inner Shareable</description>
    </register>
    <register access="WO" name="TLBIMVAAIS" size="4">
        <gui_name language="en">TLBIMVAAIS</gui_name>
        <alias_name>CP15_TLBIMVAAIS</alias_name>
        <device_name type="rvi">CP15_TLBIMVAAIS</device_name>
        <device_name type="cadi">TLBIMVAAIS</device_name>
        <description language="en">Invalidate Unified TLB entry by MVA all ASID Inner Shareable</description>
    </register>
    <register access="WO" name="TLBIALL" size="4">
        <gui_name language="en">TLBIALL</gui_name>
        <alias_name>CP15_TLBIALL</alias_name>
        <device_name type="rvi">CP15_TLBIALL</device_name>
        <device_name type="cadi">TLBIALL</device_name>
        <description language="en">Invalidate entire Unified TLB</description>
    </register>
    <register access="WO" name="TLBIMVA" size="4">
        <gui_name language="en">TLBIMVA</gui_name>
        <alias_name>CP15_TLBIMVA</alias_name>
        <device_name type="rvi">CP15_TLBIMVA</device_name>
        <device_name type="cadi">TLBIMVA</device_name>
        <description language="en">Invalidate Unified TLB by MVA</description>
    </register>
    <register access="WO" name="TLBIASID" size="4">
        <gui_name language="en">TLBIASID</gui_name>
        <alias_name>CP15_TLBIASID</alias_name>
        <device_name type="rvi">CP15_TLBIASID</device_name>
        <device_name type="cadi">TLBIASID</device_name>
        <description language="en">Invalidate TLB entries by ASID Match</description>
    </register>
    <register access="WO" name="TLBIMVAA" size="4">
        <gui_name language="en">TLBIMVAA</gui_name>
        <alias_name>CP15_TLBIMVAA</alias_name>
        <device_name type="rvi">CP15_TLBIMVAA</device_name>
        <device_name type="cadi">TLBIMVAA</device_name>
        <description language="en">Invalidate TLB entries by MVA All ASID</description>
    </register>
</register_group>

</register_list>

